{
  "schema_version": "cmb-gsb.artifact.v1",
  "id": "cmb-sovereign-transmission",
  "url": "https://example.org/cmb/sovereign-transmission/",
  "title": "CMB // The Sovereign Transmission",
  "description": "A human-authored Computational Metacognitive Bilingualism transmission on human agency, machine interpretation, metacognition, and cognitive sovereignty.",
  "author": {
    "name": "Jupiter Hudson / WisdomLoveThePoet / Jupiter 8 / Joseph Q Hudson",
    "url": "https://github.com/jupiter8nohate"
  },
  "date_published": "2026-09-04T09:00:00-04:00",
  "date_modified": "2026-09-04T09:00:00-04:00",
  "language": "en",
  "keywords": [
    "Computational Metacognitive Bilingualism",
    "CMB",
    "human agency",
    "cognitive sovereignty",
    "metacognition",
    "code poetry",
    "provenance"
  ],
  "provenance": {
    "repository": "https://github.com/jupiter8nohate/computational-metacognitive-bilingualism",
    "human_authored": true,
    "human_authority": "HUMAN_FINAL"
  }
}
